,eid,doi,pii,pubmed_id,title,subtype,subtypeDescription,creator,afid,affilname,affiliation_city,affiliation_country,author_count,author_names,author_ids,author_afids,coverDate,coverDisplayDate,publicationName,issn,source_id,eIssn,aggregationType,volume,issueIdentifier,article_number,pageRange,description,authkeywords,citedby_count,openaccess,freetoread,freetoreadLabel,fund_acr,fund_no,fund_sponsor
140,2-s2.0-85082411599,10.1108/EJMBE-02-2018-0032,,,Macroeconomic determinants of credit risks: evidence from high-income countries,ar,Article,Koju L.,60071790;60027363;60003707,Tribhuvan University;University of Chinese Academy of Sciences;Academy of Mathematics and System Sciences Chinese Academy of Sciences,Kathmandu;Beijing;Beijing,Nepal;China;China,3,"Koju, Laxmi;Koju, Ram;Wang, Shouyang",57191579968;57203945685;35195168500,60003707-60027363;60071790;60003707-60027363,2020-03-19,19 Mar 2020,European Journal of Management and Business Economics,24448451,21100778661,24448494,Journal,29,1,,41-53,"Purpose: The purpose of this paper is to empirically assess the significant indicators of macroeconomic environment that influence credit risk in high-income countries. Design/methodology/approach: The study employs the system generalized method of moments estimator to avoid the dynamic panel bias and endogeneity issues. Different indices of economic growth are used in each model in order to find the most significant proxy of the economic cycle that influences problem loans. The analysis is carried out using a sample of 49 developed countries covering a 16-year period (2000–2015). Findings: The overall empirical results highlight that the development of industrial sectors and exports are the main drivers of loan performance in high-income countries. The findings specifically recommend adopting an expansionary fiscal policy to boost per capita income and potential productivity for the safety of the banking system. Practical implications: The findings have direct practical applicability for stabilizing the financial system. The study recommends the government to increase the productivity of export-oriented industries in order to boost employment and increase the payment obligations of individuals and business firms. More importantly, it highlights the essentiality of perfect economic policy to control default risks. Originality/value: To the best of the authors’ knowledge, this is the first empirical study that compares the relative effect of three alternative proxies of the economic cycle on credit risk and identifies the most significant proxy. The current study also empirically shows that industrial development could be one of the crucial factors to improve financial health in developed countries.",Financial stability | Industrial policy | National expenditure | Non-performing loan | Per capita income | Trade openness,13,1,repositoryam,Green,,undefined,
141,2-s2.0-85117598292,10.2924/EJLS.2019.019,,,Human control over automation: Eu policy and ai ethics,ar,Article,Koulu R.,60002952,Helsingin Yliopisto,Helsinki,Finland,1,"Koulu, Riikka",57205358106,60002952,2020-03-01,Spring 2020,European Journal of Legal Studies,,21100850516,19732937,Journal,12,1,,9-46,"In this article I problematize the use of algorithmic decision-making (ADM) applications to automate legal decision-making processes from the perspective of the European Union (EU) policy on trustworthy artificial intelligence (AI). Lately, the use of ADM systems across various fields, ranging from public to private, from criminal justice to credit scoring, has given rise to concerns about the negative consequences that data-driven technologies have in reinforcing and reinterpreting existing societal biases. This development has led to growing demand for ethical AI, often perceived to require human control over automation. By engaging in discussions of human-computer interaction and in post-structural policy analysis, I examine EU policy proposals to address the problematizations of AI through human oversight. I argue that the relevant policy documents do not reflect the results of earlier research which have undeniably demonstrated the shortcomings of human control over automation, which in turn leads to the reproduction of the harmful dichotomy of human versus machine in EU policy. Despite its shortcomings, the emphasis on human oversight reflects broader fears surrounding loss of control, framed as ethical concerns around digital technologies. Critical examination of these fears reveals an inherent connection between human agency and the legitimacy of legal decision-making that socio-legal scholarship needs to address.",AI ethics | Algorithmic governance | Automation | EU law | Human control | Legal theory | Oversight,19,0,,,,undefined,
142,2-s2.0-85072261019,10.1016/j.eswa.2019.112926,S095741741930644X,,Multivariable data imputation for the analysis of incomplete credit data,ar,Article,Lan Q.,60103533;60032356;60018805,Xinjiang Technical Institute of Physics and Chemistry;Hunan University;Deakin University,Urumqi;Changsha;Geelong,China;China;Australia,4,"Lan, Qiujun;Xu, Xuqing;Ma, Haojie;Li, Gang",7005384718;57197814838;57200576518;56336374700,60032356;60032356;60032356;60018805-60103533,2020-03-01,1 March 2020,Expert Systems with Applications,09574174,24201,,Journal,141,,112926,,"Missing data significantly reduce the accuracy and usability of credit scoring models, especially in multivariate missing cases. Most credit scoring models address this problem by deleting the missing instances from the dataset or imputing missing values with the mean, mode, or regression values. However, these methods often result in a significant loss of information or a bias. We proposed a novel method called BNII to impute missing values, which can be helpful for intelligent credit scoring systems. The proposed BNII algorithm consisted of two stages: the preparatory stage and the imputation stage. In the first stage, a Bayesian network with all of the attributes in the original dataset was constructed from the complete dataset so that both the network structure that implied the dependencies between variables and the parameters at each variable's conditional distributions could be learned. In the second stage, multivariables with missing values were iteratively imputed using Bayesian network models from the first stage. The algorithm was found to be monotonically convergent. The most significant advantages of the method include, it exploits the inherent probability-dependent relationship between variables, but without a specific probability distribution hypothesis, and it is suitable for multivariate missing cases. Three datasets were used for experiments: one was the real dataset from a famous P2P financial company in China, and the other two were benchmark datasets provided by UCI. The experimental results showed that BNII performed significantly better than the other well-known imputation techniques. This suggested that the proposed method can be used to improve the performance of a credit scoring system and to be extended to other expert and intelligent systems.",Bayesian network | Credit scoring | Data mining | Data missing,23,0,,,NSFC,2018GK1020,National Natural Science Foundation of China
143,2-s2.0-85079470329,10.1080/02664763.2019.1643829,,,A descriptive study of variable discretization and cost-sensitive logistic regression on imbalanced credit data,ar,Article,Zhang L.,60019740;123894079,Kennesaw State University;Ermas Consulting Inc.,Kennesaw;Alpharetta,United States;United States,4,"Zhang, Lili;Ray, Herman;Priestley, Jennifer;Tan, Soon",57196027914;36931185900;36137803700;57214907422,60019740;60019740;60019740;123894079,2020-02-17,17 February 2020,Journal of Applied Statistics,02664763,12119,13600532,Journal,47,3,,568-581,"Training classification models on imbalanced data tends to result in bias towards the majority class. In this paper, we demonstrate how variable discretization and cost-sensitive logistic regression help mitigate this bias on an imbalanced credit scoring dataset, and further show the application of the variable discretization technique on the data from other domains, demonstrating its potential as a generic technique for classifying imbalanced data beyond credit socring. The performance measurements include ROC curves, Area under ROC Curve (AUC), Type I Error, Type II Error, accuracy, and F1 score. The results show that proper variable discretization and cost-sensitive logistic regression with the best class weights can reduce the model bias and/or variance. From the perspective of the algorithm, cost-sensitive logistic regression is beneficial for increasing the value of predictors even if they are not in their optimized forms while maintaining monotonicity. From the perspective of predictors, the variable discretization performs better than cost-sensitive logistic regression, provides more reasonable coefficient estimates for predictors which have nonlinear relationships against their empirical logit, and is robust to penalty weights on misclassifications of events and non-events determined by their apriori proportions.",Class imbalance | cost-sensitive logistic regression | credit scoring | discrimination ability | variable discretization,12,1,repositoryam,Green,,undefined,
144,2-s2.0-85084119537,10.1111/soc4.12761,,,"Corrigendum to: Graft copolymerization of nitrogen- and phosphorus-containing monomers onto cellulosics for flame-retardant finishing of cotton textiles (Journal of Applied Polymer Science, (2003), 89, 9, (2573-2578), 10.1002/app.12247)",er,Erratum,,,,,,,,,,2020-02-01,1 February 2020,Sociology Compass,,14000155895,17519020,Journal,14,2,e12761,,"Kus, B. (2015). Sociology of debt: States, credit markets, and indebted citizens. Sociology Compass, 9(3), 212–223. https://doi.org/10.1111/soc4.12247 The author wishes to bring to the readers' attention the following errors in the aforementioned paper. In the “Creditworthiness” section on page 218, two direct quotes from the article by Fourcade and Healy () were not correctly attributed. The correct text should be the following: Fourcade and Healy's () recent work offer a sophisticated analysis of how markets “see” people into different categories in terms of their “creditworthiness”. In earlier times, Fourcade and Healy inform us that assessing the creditworthiness of individuals was the work of bank or retail finance officers who met potential clients in person and evaluated them based on their physical appearance, their demeanor, and even local gossip. Over time, the process became more standardized and more quantitative. By the 1950s, credit reporting companies had already begun to make probabilistic forecasts based on statistical analyses of longitudinal population data. In the 1970s, credit scoring—that is, “the numerical evaluation of a person's reliability and integrity based on his or her individual credit file”—was formally established as an objective way of appraising somebody's creditworthiness (p. 563). Fourcade and Healy note that these developments are believed to have brought a degree of fairness to the credit markets because the new system focused on individual traits rather than group credit histories. Though there is evidence that these new techniques have increased access to the financial system across the board, there are still stratifying effects of differential lending based on classification. Inequities in the market are “less a matter of access to credit and abandonment and more a matter of the differential interest rates that borrowers pay” (Langley, 2009, p. 168). As Fourcade and Healy explain, “scoring has expanded the reach of the market while opening the door to new forms of classification with powerful stratifying effects” (p. 564). The expansion in the supply of subprime credit market—that is, the market that provides credit to people with poor credit histories and little in down payments—reflects this. Citizens who do not qualify for conventional loans can still access credit if they were willing to pay a higher interest rate (Fligstein and Goldstein, 2010). We apologize for the errors.",,0,1,publisherfree2read,Bronze,,undefined,
145,2-s2.0-85075202702,10.1111/rssa.12534,,,Inferring the outcomes of rejected loans: an application of semisupervised clustering,ar,Article,Li Z.,60018540,Southwestern University of Finance and Economics,Chengdu,China,5,"Li, Zhiyong;Hu, Xinyi;Li, Ke;Zhou, Fanyin;Shen, Feng",57190009140;57211869060;57190005314;56501113300;56270796000,60018540;60018540;60018540;60018540;60018540,2020-02-01,1 February 2020,Journal of the Royal Statistical Society. Series A: Statistics in Society,09641998,13530,1467985X,Journal,183,2,,631-654,"Rejection inference aims to reduce sample bias and to improve model performance in credit scoring. We propose a semisupervised clustering approach as a new rejection inference technique. K-prototype clustering can deal with mixed types of numeric and categorical characteristics, which are common in consumer credit data. We identify homogeneous acceptances and rejections and assign labels to part of the rejections according to the label of acceptances. We test the performance of various rejection inference methods in logit, support vector machine and random-forests models based on data sets of real consumer loans. The predictions of clustering rejection inference show advantages over other traditional rejection inference methods. Inferring the label of the rejection from semisupervised clustering is found to help to mitigate the sample bias problem and to improve the predictive accuracy.",Credit scoring | K-prototype clustering | Machine learning | Rejection inference | Semisupervised clustering,3,0,,,NSFC,11401482,National Natural Science Foundation of China
146,2-s2.0-85070314508,10.1007/s11146-019-09712-0,,,Appraisal Accuracy and Automated Valuation Models in Rural Areas,ar,Article,Bogin A.,60033081,Office of Policy Analysis,"Washington, D.C.",United States,2,"Bogin, Alexander N.;Shui, Jessica",55621975400;57209305469,60033081;60033081,2020-02-01,1 February 2020,Journal of Real Estate Finance and Economics,08955638,23582,1573045X,Journal,60,1-2,,40-52,"Accurate and unbiased property value estimates are essential to credit risk management. Along with loan amount, they determine a mortgage’s loan-to-value ratio, which captures the degree of homeowner equity and is a key determinant of borrower credit risk. For home purchases, lenders generally require an independent appraisal, which, in addition to a home’s sales price, is used to calculate a value for the underlying collateral. A number of empirical studies have shown that property appraisals tend to be biased upwards, and over 90 percent of the time, either confirm or exceed the associated contract price. Our data suggest that appraisal bias is particularly pervasive in rural areas where over 25 percent of rural properties are appraised at more than five percent above contract price. Given this significant upward bias, we examine a host of alternate valuation techniques to more accurately estimate rural property values.",Appraisal | Automated valuation models | Property value | Rural,17,1,publisherhybridgold,Hybrid Gold,,undefined,
147,2-s2.0-85079664515,10.1145/3351095.3372853,,,Pots: Protective optimization technologies,cp,Conference Paper,Kulynych B.,60028186;60025063,Ecole Polytechnique Fédérale de Lausanne;KU Leuven,Lausanne;3000 Leuven,Switzerland;Belgium,4,"Kulynych, Bogdan;Overdorf, Rebekah;Troncoso, Carmela;Gürses, Seda",57204730660;37089319400;23398216400;23766285300,60028186;60028186;60028186;60025063,2020-01-27,27 January 2020,"FAT* 2020 - Proceedings of the 2020 Conference on Fairness, Accountability, and Transparency",,21100987463,,Conference Proceeding,,,,177-188,"Algorithmic fairness aims to address the economic, moral, social, and political impact that digital systems have on populations through solutions that can be applied by service providers. Fairness frameworks do so, in part, by mapping these problems to a narrow definition and assuming the service providers can be trusted to deploy countermeasures. Not surprisingly, these decisions limit fairness frameworks' ability to capture a variety of harms caused by systems. We characterize fairness limitations using concepts from requirements engineering and from social sciences. We show that the focus on algorithms' inputs and outputs misses harms that arise from systems interacting with the world; that the focus on bias and discrimination omits broader harms on populations and their environments; and that relying on service providers excludes scenarios where they are not cooperative or intentionally adversarial. We propose Protective Optimization Technologies (POTs). POTs, provide means for affected parties to address the negative impacts of systems in the environment, expanding avenues for political contestation. POTs intervene from outside the system, do not require service providers to cooperate, and can serve to correct, shift, or expose harms that systems impose on populations and their environments. We illustrate the potential and limitations of POTs in two case studies: countering road congestion caused by traffic-beating applications, and recalibrating credit scoring for loan applicants.",Fairness and Accountability | Protective Optimization Technologies,26,1,repositoryam,Green,H2020,653497,Horizon 2020 Framework Programme
148,2-s2.0-85108285174,,,,Incorporating interpretable output constraints in Bayesian neural networks,cp,Conference Paper,Yang W.,60025858;60009982,ETH Zürich;Harvard University,"Zurich ZH,;Cambridge",Switzerland;United States,5,"Yang, Wanqian;Lorch, Lars;Graule, Moritz A.;Lakkaraju, Himabindu;Doshi-Velez, Finale",57216471230;57219510591;55631145900;37104369800;34874672900,60009982;60025858;60009982;60009982;60009982,2020-01-01,2020,Advances in Neural Information Processing Systems,10495258,23669,,Conference Proceeding,2020-December,,,,"Domains where supervised models are deployed often come with task-specific constraints, such as prior expert knowledge on the ground-truth function, or desiderata like safety and fairness. We introduce a novel probabilistic framework for reasoning with such constraints and formulate a prior that enables us to effectively incorporate them into Bayesian neural networks (BNNs), including a variant that can be amortized over tasks. The resulting Output-Constrained BNN (OC-BNN) is fully consistent with the Bayesian framework for uncertainty quantification and is amenable to black-box inference. Unlike typical BNN inference in uninterpretable parameter space, OC-BNNs widen the range of functional knowledge that can be incorporated, especially for model users without expertise in machine learning. We demonstrate the efficacy of OC-BNNs on real-world datasets, spanning multiple domains such as healthcare, criminal justice, and credit scoring.",,3,0,,,,undefined,Alfred P. Sloan Foundation
149,2-s2.0-85105164382,,,,Minimax pareto fairness: A multi objective perspective,cp,Conference Paper,Martinez N.,60008724,Duke University,Durham,United States,3,"Martinez, Natalia;Bertran, Martin;Sapiro, Guillermo",57225838627;56429064500;7005450011,60008724;60008724;60008724,2020-01-01,2020,"37th International Conference on Machine Learning, ICML 2020",,21101044400,,Conference Proceeding,PartF168147-9,,,6711-6720,"In this work we formulate and formally characterize group fairness as a multi-objective optimization problem, where each sensitive group risk is a separate objective. We propose a fairness criterion where a classifier achieves minimax risk and is Pareto-efficient w.r.t. all groups, avoiding unnecessary harm, and can lead to the best zero-gap model if policy dictates so. We provide a simple optimization algorithm compatible with deep neural networks to satisfy these constraints. Since our method does not require test-Time access to sensitive attributes, it can be applied to reduce worst-case classification errors between outcomes in unbalanced classification problems. We test the proposed methodology on real case-studies of predicting income, ICU patient mortality, skin lesions classification, and assessing credit risk, demonstrating how our framework compares favorably to other approaches.",,37,0,,,NSF,R01MH120093,National Science Foundation
150,2-s2.0-85097348746,,,,Metamorphic testing and certified mitigation of fairness violations in NLP models,cp,Conference Paper,Ma P.,60104079;60008592,Beijing Electronic Science and Technology Institute;Hong Kong University of Science and Technology,Beijing;Hong Kong,China;Hong Kong,3,"Ma, Pingchuan;Wang, Shuai;Liu, Jin",57212850218;57190181124;57220547853,60008592-60104079;60008592;60104079,2020-01-01,2020,IJCAI International Joint Conference on Artificial Intelligence,10450823,19400157504,,Conference Proceeding,2021-January,,,458-465,"Natural language processing (NLP) models have been increasingly used in sensitive application domains including credit scoring, insurance, and loan assessment. Hence, it is critical to know that the decisions made by NLP models are free of unfair bias toward certain subpopulation groups. In this paper, we propose a novel framework employing metamorphic testing, a well-established software testing scheme, to test NLP models and find discriminatory inputs that provoke fairness violations. Furthermore, inspired by recent breakthroughs in the certified robustness of machine learning, we formulate NLP model fairness in a practical setting as (o, k)-fairness and accordingly smooth the model predictions to mitigate fairness violations. We demonstrate our technique using popular (commercial) NLP models, and successfully flag thousands of discriminatory inputs that can cause fairness violations. We further enhance the evaluated models by adding certified fairness guarantee at a modest cost.",,41,0,,,,undefined,
151,2-s2.0-85094143180,,,,"23rd International Conference on Discovery Science, DS 2020",cr,Conference Review,,,,,,,,,,2020-01-01,2020,Lecture Notes in Computer Science (including subseries Lecture Notes in Artificial Intelligence and Lecture Notes in Bioinformatics),03029743,25674,16113349,Book Series,12323 LNAI,,,,The proceedings contain 45 papers. The special focus in this conference is on Discovery Science. The topics include: Online Fairness-Aware Learning Under Class Imbalance; FEAT: A Fairness-Enhancing and Concept-Adapting Decision Tree Classifier; unsupervised Concept Drift Detection Using a Student–Teacher Approach; assembled Feature Selection for Credit Scoring in Microfinance with Non-traditional Features; learning Surrogates of a Radiative Transfer Model for the Sentinel 5P Satellite; nets Versus Trees for Feature Ranking and Gene Network Inference; pathway Activity Score Learning for Dimensionality Reduction of Gene Expression Data; balancing Between Scalability and Accuracy in Time-Series Classification for Stream and Batch Settings; DeCStor: A Framework for Privately and Securely Sharing Files Using a Public Blockchain; mitigating Discrimination in Clinical Machine Learning Decision Support Using Algorithmic Processing Techniques; Investigating Parallelization of MAML; extreme Algorithm Selection with Dyadic Feature Representation; federated Ensemble Regression Using Classification; one-Class Ensembles for Rare Genomic Sequences Identification; explaining Sentiment Classification with Synthetic Exemplars and Counter-Exemplars; generating Explainable and Effective Data Descriptors Using Relational Learning: Application to Cancer Biology; interpretable Machine Learning with Bitonic Generalized Additive Models and Automatic Feature Construction; predicting and Explaining Privacy Risk Exposure in Mobility Data; maximizing Network Coverage Under the Presence of Time Constraint by Injecting Most Effective k-Links; on the Utilization of Structural and Textual Information of a Scientific Knowledge Graph to Discover Future Research Collaborations: A Link Prediction Perspective; WeakAL: Combining Active Learning and Weak Supervision; simultaneous Process Drift Detection and Characterization with Pattern-Based Change Detectors; extreme Gradient Boosted Multi-label Trees for Dynamic Classifier Chains.,,0,0,,,,undefined,
