,eid,doi,pii,pubmed_id,title,subtype,subtypeDescription,creator,afid,affilname,affiliation_city,affiliation_country,author_count,author_names,author_ids,author_afids,coverDate,coverDisplayDate,publicationName,issn,source_id,eIssn,aggregationType,volume,issueIdentifier,article_number,pageRange,description,authkeywords,citedby_count,openaccess,freetoread,freetoreadLabel,fund_acr,fund_no,fund_sponsor
225,2-s2.0-84888144500,10.1016/j.jue.2013.10.005,S0094119013000831,,Reconciling theory and empirics on the role of unemployment in mortgage default,ar,Article,Gyourko J.,60022452;60019743,Wharton School of the University of Pennsylvania;Federal Reserve Bank of New York,Philadelphia;New York,United States;United States,2,"Gyourko, Joseph;Tracy, Joseph",6601926430;7101966021,60022452;60019743,2014-03-01,March 2014,Journal of Urban Economics,00941190,24406,,Journal,80,,,87-96,"Empirical models of mortgage default typically find that the influence of unemployment is negligible compared to other well known risk factors such as high borrower leverage or low borrower FICO scores. This is at odds with theory, which assigns a critical role to unemployment in the decision to stop payment on a mortgage. We help reconcile this divergence by employing a novel empirical strategy involving simulated unemployment histories to measure the severity of attenuation bias in loan-level estimations of default risk due to a borrower becoming unemployed. Attenuation bias results because individual data on unemployment status is unobserved, requiring that a market-wide unemployment rate be used as a proxy. Attenuation is extreme, with our results suggesting that the use of an aggregate unemployment rate in lieu of actual borrower unemployment status results in default risk from a borrower becoming unemployed being underestimated by a factor more than 100. In addition, our analysis indicates that adding the unemployment rate as a proxy for the missing borrower-specific unemployment indicator does not improve the accuracy of the estimated model over the specification without the proxy variable included. Hence, aggregate portfolio-level risk estimates for mortgage guarantors such as FHA also are not improved. These views represent those of the authors and not necessarily those of the Federal Reserve Bank of New York or the Federal Reserve System. This is a revised version of a paper that previously circulated under the title ""Unemployment and Unobserved Credit Risk in the FHA Single Family Mortgage Insurance Fund (NBER Working Paper No. 18880). John Grigsby provided excellent research assistance. We appreciate the helpful comments of Andrew Haughwout, Wilbert van der Klaauw, the editor (Stuart Rosenthal) and referees, but remain responsible for any errors. © 2013 Elsevier Inc.",FHA | Mortgage default | Unemployment,29,0,,,,undefined,
226,2-s2.0-84939604004,10.1016/j.jbankfin.2014.05.010,S037842661400171X,,Loss severities on residential real estate debt during the Great Recession,ar,Article,Andersson F.,60024782,Office of the Comptroller of the Currency,"Washington, D.C.",United States,2,"Andersson, Fredrik;Mayock, Tom",57225418815;26032193900,60024782;60024782,2014-01-01,September 2014,Journal of Banking and Finance,03784266,17472,,Journal,46,1,,266-284,This study develops estimates of expected loss severities on mortgage exposures using data from Florida during the Great Recession. This paper marks the first attempt at addressing sample selectivity in the context of loss models. We also construct measures of home equity that are more accurate than those employed in previous studies. We find that failing to address sample selection and the use of noisy equity measures in loss models can bias loss estimates significantly. We also find significantly higher loss severities and a greater sensitivity of loss severity to equity than what previous studies report. © 2014.,Capital model | Credit risk | Home equity | Loss severity | Mortgages | Sample selection,10,0,,,,undefined,
227,2-s2.0-84921333598,10.4028/www.scientific.net/AMM.687-691.4934,,,The application of risk data measures mode of bias statistics in the financial markets with computer analysis,cp,Conference Paper,Guo J.,109159216,Shaanxi Vocational and Technical College,Xi'an,China,2,"Guo, Jiapeng;Bai, Lian",56486353200;56486760200,109159216;109159216,2014-01-01,2014,Applied Mechanics and Materials,16609336,4700151914,16627482,Book Series,687-691,,,4934-4937,"The core problem of effective control and management of financial risk is how to measure the risk. It is very necessary to cable model statistics new, scientific and reasonable to predict and prevent the risks that may be encountered. This article is precisely launches the research under such a background to explore the model of Bayesian statistical analysis on financial market risk measurement. And the three main types of risks in China's financial market: credit risk and market risk, operational risk and the empirical analysis, China's financial market risk causes and puts forward the prevention countermeasures and suggestions of reducing the financial risks.",Bayesian statistics | Financial risks | Gibbs sampling | Markov Chain Monte Carlo | Sport,0,0,,,,undefined,
228,2-s2.0-84903947542,10.3150/13-BEJ517,,,Small-time asymptotics of stopped Lévy bridges and simulation schemes with controlled bias,ar,Article,Figueroa-López J.E.,60123796;60028629,Université Paris Cité;College of Science,Paris;West Lafayette,France;United States,2,"Figueroa-López, José E.;Tankov, Peter",24528387300;15849721700,60028629;60123796,2014-01-01,August 2014,Bernoulli,13507265,4700152871,,Journal,20,3,,1126-1164,"We characterize the small-time asymptotic behavior of the exit probability of a Lévy process out of a two-sided interval and of the law of its overshoot, conditionally on the terminal value of the process. The asymptotic expansions are given in the form of a first-order term and a precise computable error bound. As an important application of these formulas, we develop a novel adaptive discretization scheme for theMonte Carlo computation of functionals of killed Lévy processes with controlled bias. The considered functionals appear in several domains of mathematical finance (e.g., structural credit risk models, pricing of barrier options, and contingent convertible bonds) as well as in natural sciences. The proposed algorithm works by adding discretization points sampled from the Lévy bridge density to the skeleton of the process until the overall error for a given trajectory becomes smaller than the maximum tolerance given by the user. © 2014 ISI/BS.",Adaptive discretization | Barrier options | Bridge Monte Carlo methods | Exit probability | Killed Lévy process | Lévy bridge | Small-time asymptotics,4,1,repositoryam,Green,NSF,0906919,National Science Foundation
229,2-s2.0-84902133354,10.1111/jsbm.12049,,,Small Business Credit Scoring and Its Pitfalls: Evidence from Japan,ar,Article,Hasumi R.,60030526;100413700,Hosei University;Japan Center for Economic Research,Tokyo;Tokyo,Japan;Japan,2,"Hasumi, Ryo;Hirata, Hideaki",55811020200;15837069000,100413700;60030526,2014-01-01,July 2014,Journal of Small Business Management,00472778,28581,1540627X,Journal,52,3,,555-568,"This paper studies the Japanese credit scoring market using data on 2,000 small and medium-sized enterprises and a small business credit scoring (SBCS) model widely used in the market. After constructing a model for determining a bank's profit maximization, some simulation exercises are conducted, and pitfalls of lending based on SBCS are indicated. The simulation results suggest that the reason why SBCS loan losses occur would be the combination of adverse selection and window-dressing problems. In addition, omitted variable bias and transparency of financial statements are important. © 2013 International Council for Small Business.",,9,0,,,JSPS,24730253,Japan Society for the Promotion of Science
230,2-s2.0-84901228568,10.1016/j.intfin.2014.03.014,S1042443114000407,,The impact of currency movements on asset value correlations,ar,Article,Byström H.,60029170,Lunds Universitet,Lund,Sweden,1,"Byström, Hans",6603198303,60029170,2014-01-01,July 2014,"Journal of International Financial Markets, Institutions and Money",10424431,17531,,Journal,31,1,,178-186,"This paper looks at the asset correlation bias resulting from firms' assets and liabilities being denominated in different currencies. It focuses on the time-variation in the bias and on the dependency of the bias on currency movements. Overall, we find that the asset correlation bias for the average pair of firms in the Dow Jones Industrial Average index is significant. The bias fluctuates widely, however, and it has turned negative for shorter periods. The policy implication of the paper is that by ignoring the exchange rate component when computing portfolio credit risk one may materially underestimate the actual risk. © 2014 The Author.",Asset correlation | Currency risk | Exchange rate | Sensitivity | Time-variation,4,1,repositoryam,Green,,undefined,
231,2-s2.0-84897434478,,,,The scored society: Due process for automated predictions,ar,Article,Citron D.K.,60011764,University of Maryland School of Law,Baltimore,United States,2,"Citron, Danielle Keats;Pasquale, Frank",16068125800;24173723100,60011764;60011764,2014-01-01,March 2014,Washington Law Review,00430617,22194,,Journal,89,1,,1-33,"Big Data is increasingly mined to rank and rate individuals. Predictive algorithms assess whether we are good credit risks, desirable employees, reliable tenants, valuable customers-or deadbeats, shirkers, menaces, and ""wastes of time."" Crucial opportunities are on the line, including the ability to obtain loans, work, housing, and insurance. Though automated scoring is pervasive and consequential, it is also opaque and lacking oversight. In one area where regulation does prevail-credit-the law focuses on credit history, not the derivation of scores from data. Procedural regularity is essential for those stigmatized by ""artificially intelligent"" scoring systems. The American due process tradition should inform basic safeguards. Regulators should be able to test scoring systems to ensure their fairness and accuracy. Individuals should be granted meaningful opportunities to challenge adverse decisions based on scores miscategorizing them. Without such protections in place, systems could launder biased and arbitrary data into powerfully stigmatizing scores.",,400,0,,,,undefined,
232,2-s2.0-84896348610,10.5829/idosi.mejsr.2014.21.01.21171,,,"Limited liability problem, bank capital and credit cycles: A behavioral economic approach",ar,Article,Burakov D.,60032982,Financial University under the Government of the Russian Federation,Moscow,Russian Federation,1,"Burakov, Dmitry Vladimirovich",55938434300,60032982,2014-01-01,2014,Middle - East Journal of Scientific Research,19909233,21100201971,19998147,Journal,21,1,,28-32,"In this article we study the relationship between problem of limited liability in banking behavior, attitude toward credit risk and the role of bank capital in mitigating this problem through behavioral economic approach. The results of the study show that limited liability of banks significantly increases willingness to accept credit risks. An increase in capital adequacy requirements can sufficiently reduce risk-taking due to endowment effect. However, the presence of cognitive biases, in particular endowment and framing effect, in certain conditions can undermine the effectiveness of increased requirements to bank capital adequacy in mitigating excessive risk taking by banks over the credit cycle. © IDOSI Publications, 2014.",Bank capital | Credit cycle | Credit market | Credit risk | Endowment effect | Framing effect | Limited liability,5,0,,,,undefined,
233,2-s2.0-84894107954,10.1057/jors.2013.55,JORS201355,,Selection bias in credit scorecard evaluation,cp,Conference Paper,Hand D.J.,60020650;60015150,University of Bristol;Imperial College London,Bristol;London,United Kingdom;United Kingdom,2,"Hand, David J.;Adams, Niall M.",23372323500;7201727628,60015150;60015150-60020650,2014-01-01,March 2014,Journal of the Operational Research Society,01605682,22236,14769360,Journal,65,3,,408-415,"Selection bias is a perennial problem when constructing and evaluating scorecards. It is familiar in the context of reject inference, but crops up in many other situations as well. In this paper, we examine the impact of how accepting or rejecting customers using one scorecard leads to biased comparisons of performance between that scorecard and others. This has important implications for organisations seeking to improve or replace scorecards. © 2014 Operational Research Society Ltd. All rights reserved.",area under the ROC curve | credit scoring | Kolmogorov-Smirnov statistic | selection bias,15,0,,,,undefined,
234,2-s2.0-84890735361,,,,Are underrated bonds underpriced? Biased ratings and corporate bond pricing,ar,Article,Venkiteshwaran V.,60002208,Texas A and M University - Corpus Christi,Corpus Christi,United States,1,"Venkiteshwaran, Vinod",43061626800,60002208,2013-12-24,2013,Banking and Finance Review,19477945,21100201043,19476140,Journal,5,1,,77-90,"Credit rating agencies have suffered a serious loss in credibility in light of their role in the recent mortgage credit crisis of 2008. The documented bias in credit ratings confronts financial markets with uncertainties regarding their relevance. Should investors continue to rely on credit ratings in their portfolio allocation decisions? Should banks use ratings to evaluate credit risk of collateral? Should corporate managers consider the impact on ratings when formulating financial policies? This study addresses one aspect of this broad issue and evaluates if and how rating biases affect corporate bond pricing and yield spreads. If bonds receive better (worse) ratings than justified and bond markets rely on these biased ratings, then bonds would be over (under) priced and thus trade at smaller (larger) yield spreads. Using a large sample of initial bond ratings from Standard and Poor's, Moody's and Fitch between 1995 and 2010, this study discovered that credit ratings continue to elicit informational value beyond financial and issue-related characteristics. However, the yield spreads of bonds-which are subject to rating biases-suggests that capital market participants recognize and correct for these biases through bond pricing. © 2013, Banking and Finance Review.",Bond yields | Credit ratings | Yating inflation,1,0,,,,undefined,
235,2-s2.0-84892863433,10.1007/978-3-642-40319-4_10,,,On the evaluation of the homogeneous ensembles with CV-passports,cp,Conference Paper,Nikulin V.,60104421;60011357;60011019,Vyatka State University;National Sun Yat-Sen University;Queensland University of Technology,Kirov;Kaohsiung;Brisbane,Russian Federation;Taiwan;Australia,3,"Nikulin, Vladimir;Bakharia, Aneesha;Huang, Tian Hsiang",56889191400;35483119700;14067352500,60104421;60011019;60011357,2013-12-01,2013,Lecture Notes in Computer Science (including subseries Lecture Notes in Artificial Intelligence and Lecture Notes in Bioinformatics),03029743,25674,16113349,Book Series,7867 LNAI,,,109-120,"Ensembles are often capable of greater prediction accuracy than any of their individual members. As a consequence of the diversity between individual base-learners, an ensemble will not suffer from overfitting. In this regard, development of a systematic and automatic approach for the evaluation of ensemble solutions is particularly important. Based on the mechanism of homogeneous ensembling (known, also, as bagging), we can construct a passport of the solution as a unified validation trajectory against all available training data. Assuming that passports mimic closely the corresponding test solutions, we can use them for the consideration of many tasks including optimizations of blends and ensembles, calculation of the biases and any other tests as required. The reported results were obtained online during the International PAKDD data mining competition in 2010, where we were awarded a certificate for the fourth best result. We, also, report results from the second most popular contest on the Kaggle platform named ""Credit"", where we demonstrate one of the best results. © Springer-Verlag 2013.",Boosting | Classification | Cross-validation | Data mining competitions | Decision trees | Ensemble and base learner | Financial credit risk assessment,5,0,,,,undefined,
236,2-s2.0-84887334005,10.1111/medu.12283,,24206151,Threats to validity in the use and interpretation of script concordance test scores,ar,Article,Lineberry M.,60027561;60024324,University of Illinois at Chicago;University of Iowa,Chicago;Iowa City,United States;United States,3,"Lineberry, Matthew;Kreiter, Clarence D.;Bordage, Georges",55582054400;23106647000;7003531826,60027561;60024324;60027561,2013-12-01,December 2013,Medical Education,03080110,17806,13652923,Journal,47,12,,1175-1183,"Context: Recent reviews have claimed that the script concordance test (SCT) methodology generally produces reliable and valid assessments of clinical reasoning and that the SCT may soon be suitable for high-stakes testing. Objectives: This study is intended to describe three major threats to the validity of the SCT not yet considered in prior research and to illustrate the severity of these threats. Methods: We conducted a review of SCT reports available through the Web of Science database. Additionally, we reanalysed scores from a previously published SCT administration to explore issues related to standard SCT scoring practice. Results: Firstly, the predominant method for aggregate and partial credit scoring of SCTs introduces logical inconsistencies in the scoring key. Secondly, our literature review shows that SCT reliability studies have generally ignored inter-panel, inter-panellist and test-retest measurement error. Instead, studies have focused on observed levels of coefficient alpha, which is neither an informative index of internal structure nor a comprehensive index of reliability for SCT scores. As such, claims that SCT scores show acceptable reliability are premature. Finally, SCT criteria for item inclusion, in concert with a statistical artefact of the SCT format, cause anchors at the extremes of the scale to have less expected credit than anchors near or at the midpoint. Consequently, SCT scores are likely to reflect construct-irrelevant differences in examinees' response styles. This makes the test susceptible to bias against candidates who endorse extreme scale anchors more readily; it also makes two construct-irrelevant test taking strategies extremely effective. In our reanalysis, we found that examinees could drastically increase their scores by never endorsing extreme scale points. Furthermore, examinees who simply endorsed the scale midpoint for every item would still have outperformed most examinees who used the scale as it is intended. Conclusions: Given the severity of these threats, we conclude that aggregate scoring of SCTs cannot be recommended. Recommendations for revisions of SCT methodology are discussed. © 2013 John Wiley & Sons Ltd.",,60,1,repositoryam,Green,,undefined,
237,2-s2.0-84973548521,10.21314/JCR.2013.165,,,Sample selection bias in acquisition credit scoring models: An evaluation of the supplemental-data approach,ar,Article,Barakova I.,60024782,Office of the Comptroller of the Currency,"Washington, D.C.",United States,3,"Barakova, Irina;Glennon, Dennis;Palvia, Ajay",6504810535;6602888671;36632905000,60024782;60024782;60024782,2013-09-01,September 2013,Journal of Credit Risk,17446619,21100464708,17559723,Journal,9,3,,77-117,"Models evaluating credit applicants rely on payment performance data, which is only available for accepted applicants. This sampling limitation could lead to biased parameter estimates. We use a nationally representative sample of credit bureau records to examine sample selection bias in account acquisition scoring models and to evaluate the effectiveness of the industry practice of using proxy payment performance for rejected applicants. Our results show that ignoring the rejected applicants significantly affects forecast accuracy of credit scores, while it has little effect on their discriminatory power. Finally, we document that validating scores only on accepted applicants can be misleading.",,3,0,,,,undefined,
238,2-s2.0-84870252719,10.1016/j.eswa.2012.08.052,S0957417412010135,,A window of opportunity: Assessing behavioural scoring,ar,Article,Kennedy K.,60012873;113073354,Technological University Dublin;Irish Credit Bureau,Dublin;Dublin,Ireland;Ireland,5,"Kennedy, K.;Mac Namee, B.;Delany, S. J.;O'Sullivan, M.;Watson, N.",57198245152;33568100700;10043317900;57540257000;57198267736,60012873;60012873;60012873;113073354;113073354,2013-03-01,March 2013,Expert Systems with Applications,09574174,24201,,Journal,40,4,,1372-1380,"After credit has been granted, lenders use behavioural scoring to assess the likelihood of default occurring during some specific outcome period. This assessment is based on customers' repayment performance over a given fixed period. Often the outcome period and fixed performance period are arbitrarily selected, causing instability in making predictions. Behavioural scoring has failed to receive the same attention from researchers as application scoring. The bias for application scoring research can be attributed, in part, to the large volume of data required for behavioural scoring studies. Furthermore, the commercial sensitivities associated with such a large pool of customer data often prohibits the publication of work in this area. This paper focuses on behavioural scoring and evaluates the contrasting effects of altering the performance period and outcome period using 7-years worth of data from the Irish market. The results of this work indicate that a 12-month performance period yields an easier prediction task when compared with other historical payment periods of varying lengths. This article also quantifies differences in the classification performance of logistic regression arising from different outcome periods length. Our findings show that the performance of a logistic regression classifier degrades significantly when the outcome window is extended beyond 6-month. Finally we consider different approaches to how the concept of default is defined. Typically whether the customer is identified as a default risk or not is set based on either (i) whether the account is in default at the end of the outcome period or (ii) at any time during the outcome period. This paper studies both approaches and finds that the latter approach resulted in an easier classification problem, that is, it gives the highest assurance that the classification will be correct. © 2012 Elsevier Ltd. All rights reserved.",Behavioural scoring | Credit scoring | Data mining | Supervised classification,25,0,repositoryam,Green,,undefined,
239,2-s2.0-84943007573,,,,Modelling and simulation: An overview,ar,Article,McAleer M.,60031226;60018029;60016897;60007337;60004424,Curtin University;National Tsing Hua University;Erasmus School of Economics;Tinbergen Institute - TI;The University of Waikato,Perth;Hsinchu;Rotterdam;Rotterdam;Hamilton,Australia;Taiwan;Netherlands;Netherlands;New Zealand,3,"McAleer, Michael;Chan, Felix;Oxley, Les",24370074800;7202586446;7003336774,60018029-60016897-60007337;60031226;60004424,2013-01-01,2013,Mathematics and Computers in Simulation,03784754,12166,,Journal,93,,,,"The papers in this special issue of Mathematics and Computers in Simulation cover the following topics: improving judgmental adjustment of model-based forecasts, whether forecast updates are progressive, on a constrained mixture vector autoregressive model, whether all estimators are born equal: the empirical properties of some estimators of long memory, characterising trader manipulation in a limit-order driven market, measuring bias in aterm-structure model ofcommodity prices through the comparison of simultaneous and sequential estimation, modelling tail credit risk using transition matrices, evaluation of the DPC-based inclusive payment system in Japan for cataract operations by a new model, the matching of lead underwriters and issuing firms in the Japanese corporate bond market, stochastic life table forecasting: a time-simultaneous fan chart application, adaptive survey designs for sampling rare and clustered populations, income distribution inequality, globalization, and innovation: a general equilibrium simulation, whether exchange rates affect consumer prices: a comparative analysis for Australia, China and India, the impacts of exchange rates on Australia's domestic and outbound travel markets, clean development mechanism in China: regional distribution and prospects, design and implementation of a Web-based groundwater data management system, the impact of serial correlation on testing for structural change in binary choice model: Monte Carlo evidence, and coercive journal self citations, impact factor, journal influence and article influence. © 2013 IMACS. Published by Elsevier B.V. All rights reserved.",Citations | Credit risk | Empirical finance | Exchange rates | Forecasting | Groundwater systems | Health economics | Modelling | Sampling | Simulation | Structural change | Time series models | Trading,0,0,,,,undefined,
