,eid,doi,pii,pubmed_id,title,subtype,subtypeDescription,creator,afid,affilname,affiliation_city,affiliation_country,author_count,author_names,author_ids,author_afids,coverDate,coverDisplayDate,publicationName,issn,source_id,eIssn,aggregationType,volume,issueIdentifier,article_number,pageRange,description,authkeywords,citedby_count,openaccess,freetoread,freetoreadLabel,fund_acr,fund_no,fund_sponsor
67,2-s2.0-85143414304,10.1108/IJMF-04-2022-0192,,,Executive pay disparity and cost of debt financing,ar,Article,Chou H.I.,60185896;60172575;60011664,La Trobe Business School;College of Business and Law;University of Wollongong,Melbourne;Melbourne;Wollongong,Australia;Australia;Australia,3,"Chou, Hsin I.;Pan, Xiaofei;Zhao, Jing",35274569400;37091451800;7410314180,60172575;60011664;60185896,2022-01-01,2022,International Journal of Managerial Finance,17439132,145230,,Journal,,,,,"Purpose: This paper aims to examine the relationship between executive pay disparity and the cost of debt. Design/methodology/approach: The authors use a sample of syndicated bank loans granted to United States (US) listed firms from 1992 to 2014 and adopt the loan yield spread (Chief Executive Officer (CEO) pay slice) as the main proxy for the cost of debt (executive pay disparity). The authors also use the Heckman two-stage model to address the sample selection bias and the two-stage least squares and propensity score matching methods to control the potential endogeneity issues. To test different views about executive pay disparity, the authors adopt the cash-to-stock ratio to proxy for managerial risk-shifting incentives. Findings: The authors find that the cost of debt is significantly higher for firms with larger executive pay disparity, which is robust to sample selection bias, endogeneity concerns, alternative measures and various controls. This positive relationship increases with the risk-shifting incentives of CEOs instead of other top executives, which supports the managerial power view, and is stronger for firms with higher levels of financial distress. The findings suggest that creditors view executive pay disparity are associated with higher credit risk and CEO entrenchment. Originality/value: This paper reveals one “dark” side of executive pay disparity: it increases the cost of debt and identifies a significant role played by CEOs' risk-shifting incentives. The authors provide direct evidence of the relevance of pay differential to corporate credit analysis.",Cost of debt | Executive pay disparity | Financial distress | Risk-shifting incentives,2,0,,,,undefined,
68,2-s2.0-85142286574,10.21314/JRMV.2022.023,,,Quantification of model risk with an application to probability of default estimation and stress testing for a large corporate portfolio,ar,Article,Jacobs M.,60079166,"The PNC Financial Services Group, Inc.",Pittsburgh,United States,1,"Jacobs, Michael",42061634600,60079166,2022-01-01,2022,Journal of Risk Model Validation,17539579,21100466834,17539587,Journal,16,3,,73-111,"This paper addresses the building of obligor-level hazard rate corporate probability of default models for stress testing, departing from the predominant practice in wholesale credit modeling of constructing segment-level models for this purpose. We build models based upon varied financial, credit rating, equity market and macroeconomic factors, using an extensive history of large corporate firms sourced from Moody’s. We develop distance-to-default (DTD) risk factors and design hybrid structural/Merton reduced-form models as challengers to versions of the models containing other individual variables. We measure the model risk attributed to various modeling assumptions according to the principle of relative entropy and observe that the omitted-variable bias with respect to the DTD risk factor, neglect of interaction effects and incorrect link function specification has the greatest, intermediate and least impact, respectively. Given the sensitive regulatory uses of these models and the concerns raised in the industry about the effect of model misspecification on capital and reserves, our conclusion is that validation methods chosen in the stress testing context should be capable of testing model assumptions. Our research adds to the literature in that it offers state-of-the-art techniques as viable options in the arsenal of model validators, developers and supervisors seeking to manage model risk.",Credit risk | Current expected credit loss (cecl) | Model risk | Model validation | Probability of default (pd) | Stress testing,1,0,,,,undefined,
69,2-s2.0-85142091913,10.1109/iThings-GreenCom-CPSCom-SmartData-Cybermatics55523.2022.00021,,,A Blockchain-Based Cloud Edge Fusion Computing Platform for the Smart Grid,cp,Conference Paper,Gao Y.,60024542;60021182,South China University of Technology;Sun Yat-Sen University,Guangzhou;Guangzhou,China;China,5,"Gao, Ying;Su, Sijie;Chen, Yandan;Pan, Qiaofeng;Hu, Xiping",57734459800;57967766600;57968694300;57222548295;57205479026,60024542;60024542;60024542;60024542;60021182,2022-01-01,2022,"Proceedings - IEEE Congress on Cybermatics: 2022 IEEE International Conferences on Internet of Things, iThings 2022, IEEE Green Computing and Communications, GreenCom 2022, IEEE Cyber, Physical and Social Computing, CPSCom 2022 and IEEE Smart Data, SmartData 2022",,21101120705,,Conference Proceeding,,,,204-211,"With the development of the smart grid, the number of access equipment capacity reached more than 100 million, resulting in long delays in the transmission of a large amount of data obtained from the terminal side to the cloud computing center. The emergence of powerful edge computing can greatly reduce the propagation delay, improve the management efficiency of IoT equipment in the smart grid, and reduce the communication delay between devices. However, due to decentralization, classical edge computing platforms face management and security challenges. In this paper, we propose a blockchain-based cloud edge fusion computing (BCEC) platform for controlling the smart grid, which integrates blockchain techniques to ensure the safety of the smart grid equipment. Specifically, we propose a three-level five-dimension credit scoring algorithm to ensure the security of the system. Through this algorithm, cloud computing and edge computing are combined, and the credit score of terminal equipment is allocated, taking into account the participation and security. Finally, we propose a time greedy allocation algorithm based on the Gini coefficient as a scheduling algorithm to ensure the fairness of system allocation and minimize the allocation delay. We deploy BCEC in the simulation environment for experimentation and the results show that BCEC can provide calculation services with low latency and high fairness for the smart grid system.",Blockchain | Cloud computing | Edge computing | Smart grid,1,0,,,,2021A0505030017,
70,2-s2.0-85141479534,10.1002/cjs.11732,,,Pretest and shrinkage estimators in generalized partially linear models with application to real data,ar,Article,Hossain S.,60017367;60009697,The University of Winnipeg;University of Manitoba,Winnipeg;Winnipeg,Canada;Canada,3,"Hossain, Shakhawat;Mandal, Saumen;Lac, Le An",26429465600;9436626900;57204079914,60017367;60009697;60009697,2022-01-01,2022,Canadian Journal of Statistics,03195724,28893,1708945X,Journal,,,,,"Semiparametric models hold promise to address many challenges to statistical inference that arise from real-world applications, but their novelty and theoretical complexity create challenges for estimation. Taking advantage of the broad applicability of semiparametric models, we propose some novel and improved methods to estimate the regression coefficients of generalized partially linear models (GPLM). This model extends the generalized linear model by adding a nonparametric component. Like in parametric models, variable selection is important in the GPLM to single out the inactive covariates for the response. Instead of deleting inactive covariates, our approach uses them as auxiliary information in the estimation procedure. We then define two models, one that includes all the covariates and another that includes the active covariates only. We then combine these two model estimators optimally to form the pretest and shrinkage estimators. Asymptotic properties are studied to derive the asymptotic biases and risks of the proposed estimators. We show that if the shrinkage dimension exceeds two, the asymptotic risks of the shrinkage estimators are strictly less than those of the full model estimators. Extensive Monte Carlo simulation studies are conducted to examine the finite-sample performance of the proposed estimation methods. We then apply our proposed methods to two real data sets. Our simulation and real data results show that the proposed estimators perform with higher accuracy and lower variability in the estimation of regression parameters for GPLM compared with competing estimation methods.",Asymptotic biases and risks | backfitting algorithm | credit scoring | maximum likelihood estimation | pretest estimator | semiparametrics | shrinkage estimator | Speckman estimator | variable selection,0,0,,,UM,undefined,University of Manitoba
71,2-s2.0-85137756029,10.1109/AIC55036.2022.9848897,,,Use of Soft Computing Techniques in Credit Risk Management of an Indian Bank: Application of Artificial Neural network,cp,Conference Paper,Dutta A.,60115226;60097442,"Sikkim University;Dr. B.C. Roy Engineering College, Durgapur",Gangtok;Durgapur,India;India,2,"Dutta, Abhijit;Barman, Anita Nandi",57211558781;57211561366,60115226;60097442,2022-01-01,2022,"Proceedings - 2022 IEEE World Conference on Applied Intelligence and Computing, AIC 2022",,21101107305,,Conference Proceeding,,,,562-567,"This study uses ten variables from an Indian commercial bank in India for its retail customers. The study uses a Multilayer Perceptron (MLP) - Artificial Neural network architecture to understand the usability of such data for credit risk management in India. The results are encouraging and show high level of predictability, low bias while iterating the information. This study shows that information such as income level and default to ratio of CIBIL score are highly usable information by Banks to understand the default in commercial banks. The study also shows that the use of ANN yield good predictable result and can be used for credit risk management of a bank. The model is being able to learn properly and the results are consistent which mean that such a technique can be used in the long run for the credit risk management of a bank.",Artificial Neural Network | Credit Risk | Multilayer Perception | Soft Computing,0,0,,,,undefined,
72,2-s2.0-85136666433,10.1080/00472778.2022.2108824,,,Racial disparities in the small business loan market,ar,Article,Rakshit A.,60177650;60016251,Nazarbayev University Graduate School of Business;Louisiana Tech University,Astana;Ruston,Kazakhstan;United States,2,"Rakshit, Atanu;Peterson, Jonathan",57213112324;56105285600,60177650;60016251,2022-01-01,2022,Journal of Small Business Management,00472778,28581,1540627X,Journal,,,,,"We investigate patterns of racial bias in small business loans denial rates in the US across different credit risk scores. Using data constructed from the 1998 Survey of Small Business Finances and Kauffman Firm Survey, we find disparities in loan approval ratings between Black and White entrepreneurs in intermediate risk categories, but not for the best and worst categories. We explain these findings with a simple and generalizable statistical discrimination model where banks hold prior beliefs of repayment probability based on the applicant’s group and observe noisy signals of creditworthiness. Our model predicts that differences in loan denial rates across groups are more pronounced at middle range values and disappear at very high and very low credit scores. Identifying the likely cause of differential treatment in the market is an important first step in improving representation of minority groups as entrepreneurs. Our findings contribute to this critical effort by delineating the nature of racial bias in the credit market and informing remediation policies.",access to credit | entrepreneurs | race | Small business loans | statistical discrimination,1,0,,,,undefined,
73,2-s2.0-85136081983,10.1007/978-3-031-13188-2_20,,,Verifying Fairness in Quantum Machine Learning,cp,Conference Paper,Guan J.,60027363;60025278;60025256,University of Chinese Academy of Sciences;Tsinghua University;Institute of Software Chinese Academy of Sciences,Beijing;Beijing;Beijing,China;China;China,3,"Guan, Ji;Fang, Wang;Ying, Mingsheng",57200323438;57219789493;7005164090,60025256;60025256-60027363;60025256-60025278,2022-01-01,2022,Lecture Notes in Computer Science (including subseries Lecture Notes in Artificial Intelligence and Lecture Notes in Bioinformatics),03029743,25674,16113349,Book Series,13372 LNCS,,,408-429,"Due to the beyond-classical capability of quantum computing, quantum machine learning is applied independently or embedded in classical models for decision making, especially in the field of finance. Fairness and other ethical issues are often one of the main concerns in decision making. In this work, we define a formal framework for the fairness verification and analysis of quantum machine learning decision models, where we adopt one of the most popular notions of fairness in the literature based on the intuition—any two similar individuals must be treated similarly and are thus unbiased. We show that quantum noise can improve fairness and develop an algorithm to check whether a (noisy) quantum machine learning model is fair. In particular, this algorithm can find bias kernels of quantum data (encoding individuals) during checking. These bias kernels generate infinitely many bias pairs for investigating the unfairness of the model. Our algorithm is designed based on a highly efficient data structure—Tensor Networks—and implemented on Google’s TensorFlow Quantum. The utility and effectiveness of our algorithm are confirmed by the experimental results, including income prediction and credit scoring on real-world data, for a class of random (noisy) quantum decision models with 27 qubits (2 27 -dimensional state space) tripling (2 18 times more than) that of the state-of-the-art algorithms for verifying quantum machine learning models.",Fairness Verification | Quantum Decision Model | Quantum Machine Learning | Quantum Noise,0,1,repositoryam,Green,NSFC,61832015,National Natural Science Foundation of China
74,2-s2.0-85135264199,10.1080/23737484.2022.2106325,,,Naive Bayes using the expectation-maximization algorithm for reject inference,ar,Article,Anderson B.,60007056,University of Missouri-Kansas City,Kansas City,United States,1,"Anderson, Billie",23967779600,60007056,2022-01-01,2022,Communications in Statistics Case Studies Data Analysis and Applications,,21100948959,23737484,Journal,8,3,,484-504,"In the last several years, there has been significant research in applying semi-supervised machine learning models to the reject inference problem. When a financial institution wants to build a model to predict the default of credit applicants, the institution only has a known good/bad outcome loan status for the accepted applicants; this causes an inherent bias in the model. Reject inference is used to infer the good or bad loan status of credit applicants that were rejected by a financial institution. This paper presents a reject inference technique in which a semi-supervised framework is developed using a Naive Bayes model. The framework uses the expectation-maximization (EM) algorithm to incorporate rejected applicants into the parameter estimation of the model using a bootstrapping approach. The proposed method has an advantage over traditional reject inference methods because the rejected applicant data will participate in the estimation of the model parameters, thus avoiding the extrapolation problem. The Naive Bayes model using the EM algorithm is compared to logistic regression and several semi-supervised techniques.",Credit scoring | expectation-maximization algorithm | feature binning | Naive Bayes | reject inference | semi-supervised algorithm,0,0,,,,undefined,
75,2-s2.0-85134328984,10.1007/s11146-022-09915-y,,,Accounting for Spatial Autocorrelation in Algorithm-Driven Hedonic Models: A Spatial Cross-Validation Approach,ar,Article,Deppner J.,60030807;118050390,Universität Regensburg;PATRIZIA Immobilien AG,Regensburg;Augsburg,Germany;Germany,2,"Deppner, Juergen;Cajias, Marcelo",57807736800;55325401300,60030807;60030807-118050390,2022-01-01,2022,Journal of Real Estate Finance and Economics,08955638,23582,1573045X,Journal,,,,,"Data-driven machine learning algorithms have initiated a paradigm shift in hedonic house price and rent modeling through their ability to capture highly complex and non-monotonic relationships. Their superior accuracy compared to parametric model alternatives has been demonstrated repeatedly in the literature. However, the statistical independence of the data implicitly assumed by resampling-based error estimates is unlikely to hold in a real estate context as price-formation processes in property markets are inherently spatial, which leads to spatial dependence structures in the data. When performing conventional cross-validation techniques for model selection and model assessment, spatial dependence between training and test data may lead to undetected overfitting and overoptimistic perception of predictive power. This study sheds light on the bias in cross-validation errors of tree-based algorithms induced by spatial autocorrelation and proposes a bias-reduced spatial cross-validation strategy. The findings confirm that error estimates from non-spatial resampling methods are overly optimistic, whereas spatially conscious techniques are more dependable and can increase generalizability. As accurate and unbiased error estimates are crucial to automated valuation methods, our results prove helpful for applications including, but not limited to, mass appraisal, credit risk management, portfolio allocation and investment decision making.",Automated valuation models | Hedonic modeling | Machine learning | Mass appraisal | Spatial autocorrelation | Spatial cross-validation,2,1,repositoryvor,Green,,undefined,
76,2-s2.0-85131711853,10.1109/TKDE.2022.3179025,,,RMT-Net: Reject-aware Multi-Task Network for Modeling Missing-not-at-random Data in Financial Credit Scoring,ar,Article,Liu Q.,60121285;60018486;60015481,Ant group;Institute of Automation Chinese Academy of Sciences;University of Washington,Hangzhou;Beijing;Seattle,China;China;United States,7,"Liu, Qiang;Luo, Yingtao;Wu, Shu;Zhang, Zhen;Yue, Xiangnan;Jin, Hong;Wang, Liang",56818103100;57219473950;36245362600;57735552800;57735719800;57725139000;57218666547,60018486;60015481;60018486;60121285;60121285;60121285;60018486,2022-01-01,2022,IEEE Transactions on Knowledge and Data Engineering,10414347,17362,15582191,Journal,,,,,"In financial credit scoring, loan applications may be approved or rejected. We can only observe default/non-default labels for approved samples but have no observations for rejected samples, which leads to missing-not-at-random selection bias. Machine learning models trained on such biased data are inevitably unreliable. In this work, we find that the default/non-default classification task and the rejection/approval classification task are highly correlated, according to both real-world data study and theoretical analysis. Consequently, the learning of default/non-default can benefit from rejection/approval. Accordingly, we for the first time propose to model the biased credit scoring data with Multi-Task Learning (MTL). Specifically, we propose a novel Reject-aware Multi-Task Network (RMT-Net), which learns the task weights that control the information sharing from the rejection/approval task to the default/non-default task by a gating network based on rejection probabilities. RMT-Net leverages the relation between the two tasks that the larger the rejection probability, the more the default/non-default task needs to learn from the rejection/approval task. Furthermore, we extend RMT-Net to RMT-Net++ for modeling scenarios with multiple rejection/approval strategies. Extensive experiments are conducted on several datasets, and strongly verifies the effectiveness of RMT-Net on both approved and rejected samples. In addition, RMT-Net++ further improves RMT-Net's performances.",Biological system modeling | Computational modeling | Credit scoring | Data models | default prediction | missing-not-at-random | multi-task learning | Multitasking | reject inference | Support vector machines | Task analysis | Training,2,0,repositoryam,Green,,undefined,
77,2-s2.0-85131229127,10.1080/00014788.2022.2063104,,,How do bank managers forecast the future in the shadow of the past? An examination of expected credit losses under IFRS 9,ar,Article,Du N.,60026860;60017293,DePaul University;Università degli Studi di Napoli Federico II,Chicago;Naples,United States;Italy,3,"Du, Ning;Allini, Alessandra;Maffei, Marco",26662902700;56663289900;55790188500,60026860;60017293;60017293,2022-01-01,2022,Accounting and Business Research,00014788,28034,21594260,Journal,,,,,"One of the most significant changes under IFRS 9 is the shift to considering and incorporating forward-looking information to forecast expected credit losses (ECL). This study aims to understand how bank managers incorporate forward-looking information, such as future economic projections, in assessing significant credit risk deterioration, and how bank managers evaluate the reasonableness of different forecast horizons in order to project lifetime ECL. We conducted an experiment with 72 bank managers. Our results reveal that bank managers are reluctant to incorporate good news when historical information indicates a high default risk and potentially large credit loss, and that their ECL estimates are influenced by the upward or downward shift in the forecasted losses. We view these results as consistent with the unconditional conservatism of the new ECL model.",cognitive biases | expected credit loss | forecast horizon | IFRS 9,1,0,,,,undefined,
78,2-s2.0-85130833025,10.1109/ACCESS.2022.3177783,,,Model-Agnostic Counterfactual Explanations in Credit Scoring,ar,Article,Dastile X.,60080184;60029738;60016218,"Universitetet i Agder;Queen's University Belfast;University of the Witwatersrand, Johannesburg",Kristiansand;Belfast;Johannesburg,Norway;United Kingdom;South Africa,3,"Dastile, Xolani;Celik, Turgay;Vandierendonck, Hans",57216042402;35101499300;6602259515,60016218;60016218-60080184;60029738,2022-01-01,2022,IEEE Access,,21100374601,21693536,Journal,10,,,69543-69554,"The past decade has shown a surge in the use and application of machine learning and deep learning models across various domains. One such domain is credit scoring, where applicants are scored to assess their creditworthiness for loan applications. It is essential to ensure that no biases or discriminations are incurred during the scoring process. Most machine learning and deep learning models are prone to unintended bias and discrimination in the datasets. Therefore, it is imperative to explain each prediction from the models during the scoring process to avoid the element of model bias and discrimination. Our study proposes a novel optimization formulation that generates sparse counterfactual explanations via a custom genetic algorithm to explain the black-box model's predictions. We evaluated the efficacy of the proposed method on publicly available credit scoring datasets by comparing the counterfactual explanations generated by the proposed method with explanations from credit scoring experts. The proposed counterfactual explanation method does not only explain rejected loan applications but also can be used to explain approved loan applications.",counterfactual explanation | Credit scoring | explainable AI | genetic algorithm | machine learning,2,1,repositoryvor,Green,,undefined,
79,2-s2.0-85130569971,10.1155/2022/2348084,,,Marketing System Construction and Risk Analysis Based on Random Forest of Machine Learning,ar,Article,Wang K.,60084619;106542060,University of Science and Technology Liaoning;Shenyang City University,Anshan;Shenyang,China;China,2,"Wang, Kai;Wang, Na",57206722479;58264159500,106542060;60084619,2022-01-01,2022,Wireless Communications and Mobile Computing,15308669,17543,15308677,Journal,2022,,2348084,,"This paper analyses the innovative marketing model of enterprises in the new era from the perspective of the characteristics of enterprises and the problems of innovative marketing strategies and puts forward solution strategies and suggestions to provide reference for enterprises to get faster and better development in the new era. Based on the connotation of credit in the random forest, this paper follows the principles of science, standardization, fairness, and objectivity, draws on various credit factor analysis methods and famous credit scoring systems (such as FICO and Sesame Credit), closely links with relevant government and enterprise policy documents, combines with the actual situation of enterprise market, and finally builds a credit factor from three aspects of enterprise market: foundation, marketing, and monopoly. The credit index system consists of 3 primary indicators, 10 secondary indicators, and 22 tertiary indicators.",,0,1,publisherfullgold,Gold,,undefined,
